{
  "$id": "EGpQePxZPKq9nPF99rI9IawvJgMukfPxjI6WKN8GFVfV",
  "$schema": "https://json-schema.org/draft/2020-12/schema",
  "title": "SEDI Digital Guardian",
  "description": "Provisional Bakobo SEDI guardianship profile following keripy discussion #1550: state-issued to a guardian, with the ward AID in a separately disclosable attribute block, coarse statutory scope, and separate delegable powers. Registry-bound for independent status checks.",
  "$comment": "The ward is in a.ward, not an edge. The ward Core variant has an NI2I edge back here. This is not a Sam Smith schema or a statement of Utah policy.",
  "credentialType": "SEDI_Guardian",
  "version": "3.0.0",
  "type": "object",
  "required": [
    "v",
    "t",
    "d",
    "i",
    "rd",
    "s",
    "a",
    "e",
    "r"
  ],
  "properties": {
    "v": {
      "description": "ACDC version string",
      "type": "string"
    },
    "t": {
      "description": "Message type; 'acm' is the field-map ACDC ilk",
      "const": "acm"
    },
    "d": {
      "description": "SAID of the credential",
      "type": "string"
    },
    "u": {
      "description": "Top-level blinding nonce; present => private variant",
      "type": "string"
    },
    "i": {
      "description": "Issuer = the appointing authority (court/DGO for court bases; the individual for a self-executed designation; DGO for a parental attestation)",
      "type": "string"
    },
    "rd": {
      "description": "Registry SAID for credential status -- MANDATORY; guardianship terminates dynamically",
      "type": "string"
    },
    "s": {
      "description": "SAID of this schema",
      "type": "string"
    },
    "a": {
      "oneOf": [
        {
          "description": "SAID of the attribute section",
          "type": "string"
        },
        {
          "description": "Guardian attributes, with the ward in a disclosable block",
          "type": "object",
          "required": [
            "d",
            "u",
            "i",
            "basis",
            "ward",
            "scope",
            "powers",
            "fiduciary",
            "recognition",
            "effectiveDate"
          ],
          "properties": {
            "d": {
              "description": "SAID of the attribute section",
              "type": "string"
            },
            "u": {
              "description": "Attribute-section blinding nonce",
              "type": "string"
            },
            "i": {
              "description": "Issuee = the GUARDIAN's AID (holder != subject)",
              "type": "string"
            },
            "basis": {
              "description": "Which of the four SEDI statutory bases (63A-20-201(3))",
              "enum": [
                "designatedRepresentative",
                "custodialParent",
                "courtGuardianMinor",
                "courtGuardianIncapacitated"
              ]
            },
            "subtype": {
              "description": "Sub-type of a designated representative",
              "enum": [
                "financialPOA",
                "healthCareAgent"
              ]
            },
            "ward": {
              "description": "Ward AID in an individually disclosable block",
              "oneOf": [
                {
                  "description": "Withheld ward block SAID",
                  "type": "string"
                },
                {
                  "description": "Ward block detail",
                  "type": "object",
                  "required": [
                    "d",
                    "u",
                    "i"
                  ],
                  "properties": {
                    "d": {
                      "description": "Ward block SAID",
                      "type": "string"
                    },
                    "u": {
                      "description": "Ward block blinding nonce",
                      "type": "string"
                    },
                    "i": {
                      "description": "Ward AID",
                      "type": "string"
                    }
                  },
                  "additionalProperties": false
                }
              ]
            },
            "scope": {
              "description": "Coarse statutory scope of the guardianship",
              "type": "array",
              "minItems": 1,
              "uniqueItems": true,
              "items": {
                "enum": [
                  "plenary",
                  "healthCare",
                  "residence",
                  "education",
                  "personalRecords",
                  "socialBenefits",
                  "digitalIdentity",
                  "contracts"
                ]
              }
            },
            "powers": {
              "description": "Capabilities the guardian may delegate in a separate ward authorization",
              "type": "array",
              "minItems": 1,
              "uniqueItems": true,
              "items": {
                "enum": [
                  "read",
                  "post",
                  "message",
                  "profile",
                  "configure",
                  "purchase",
                  "livestream"
                ]
              }
            },
            "fiduciary": {
              "description": "Governing standard",
              "enum": [
                "bestInterest",
                "substitutedJudgment"
              ]
            },
            "capacityConditioned": {
              "description": "Authority active only after a capacity determination (health-care agent)",
              "type": "boolean"
            },
            "residualParentalRights": {
              "description": "A parent retains residual rights (minor guardianship)",
              "type": "boolean"
            },
            "recognition": {
              "description": "Legal-recognition block: how this authority is recognized and appointed. Deliberately relationship-agnostic and clustered so a future sedi-legal-authority base can lift it verbatim (this.i @sdlg3n).",
              "type": "object",
              "required": [
                "authorityType",
                "appointingState",
                "registrationStatus"
              ],
              "properties": {
                "authorityType": {
                  "description": "How the authority arises",
                  "enum": [
                    "court",
                    "selfExecuted",
                    "inherentParental"
                  ]
                },
                "court": {
                  "description": "Appointing court name (court authorityType)",
                  "type": "string"
                },
                "caseNumber": {
                  "description": "Court case/docket number (court authorityType)",
                  "type": "string"
                },
                "orderDate": {
                  "description": "Date of the appointing order",
                  "type": "string",
                  "format": "date"
                },
                "lettersReference": {
                  "description": "Reference to the Letters of Guardianship (court authorityType)",
                  "type": "string"
                },
                "instrumentReference": {
                  "description": "Reference to the self-executed instrument -- POA or advance directive (selfExecuted authorityType)",
                  "type": "string"
                },
                "appointingState": {
                  "description": "ISO 3166-2 subdivision of the appointing jurisdiction, e.g. US-UT",
                  "type": "string"
                },
                "registrationStatus": {
                  "description": "Utah recognition status under UAGPPJA (Title 75 Ch. 5b)",
                  "enum": [
                    "native",
                    "registeredForeign",
                    "transferred"
                  ]
                },
                "utahRegistrationReference": {
                  "description": "Utah Ch. 5b registration reference (registeredForeign/transferred)",
                  "type": "string"
                }
              },
              "additionalProperties": false
            },
            "effectiveDate": {
              "description": "Date the authority takes effect",
              "type": "string",
              "format": "date"
            },
            "reviewDueDate": {
              "description": "Date a periodic review is due (Utah requires review of incapacitated-person guardianships)",
              "type": "string",
              "format": "date"
            },
            "expiryDate": {
              "description": "Date the authority expires (e.g. the minor's 18th birthday); dynamic termination is via the registry",
              "type": "string",
              "format": "date"
            }
          },
          "additionalProperties": false
        }
      ]
    },
    "e": {
      "oneOf": [
        {
          "description": "SAID of the edge section",
          "type": "string"
        },
        {
          "description": "Edge section",
          "type": "object",
          "required": [
            "d",
            "citizen",
            "authorization"
          ],
          "properties": {
            "d": {
              "description": "SAID of the edge section",
              "type": "string"
            },
            "u": {
              "description": "Edge-section blinding nonce",
              "type": "string"
            },
            "citizen": {
              "description": "E1E edge to the guardian's own SEDI Core credential",
              "oneOf": [
                {
                  "description": "SAID of the edge",
                  "type": "string"
                },
                {
                  "type": "object",
                  "required": [
                    "d",
                    "n",
                    "s",
                    "o"
                  ],
                  "properties": {
                    "d": {
                      "description": "SAID of this edge",
                      "type": "string"
                    },
                    "u": {
                      "description": "Edge blinding nonce",
                      "type": "string"
                    },
                    "n": {
                      "description": "SAID of the far node (credential)",
                      "type": "string"
                    },
                    "s": {
                      "description": "SEDI Core schema SAID",
                      "const": "EAyyREL1r5OL8Z9HGl47df26rn_JRLsC7PVDBH5RtwLs"
                    },
                    "o": {
                      "description": "Same-issuee identity relation",
                      "const": "E1E"
                    }
                  },
                  "additionalProperties": false
                }
              ]
            },
            "authorization": {
              "description": "Edge to the authorizing instrument -- the court order or Letters (often FAA-wrapped), the POA, or the advance directive",
              "oneOf": [
                {
                  "description": "SAID of the edge",
                  "type": "string"
                },
                {
                  "type": "object",
                  "required": [
                    "d",
                    "n",
                    "s",
                    "o"
                  ],
                  "properties": {
                    "d": {
                      "description": "SAID of this edge",
                      "type": "string"
                    },
                    "u": {
                      "description": "Edge blinding nonce",
                      "type": "string"
                    },
                    "n": {
                      "description": "SAID of the far node (credential)",
                      "type": "string"
                    },
                    "s": {
                      "description": "SAID of the far node's schema",
                      "type": "string"
                    },
                    "o": {
                      "description": "Edge operator",
                      "enum": [
                        "I2I",
                        "NI2I"
                      ]
                    }
                  },
                  "additionalProperties": false
                }
              ]
            },
            "constraints": {
              "description": "Optional GCD constraints edge",
              "oneOf": [
                {
                  "description": "SAID of the edge",
                  "type": "string"
                },
                {
                  "type": "object",
                  "required": [
                    "d",
                    "n",
                    "s",
                    "o"
                  ],
                  "properties": {
                    "d": {
                      "description": "SAID of this edge",
                      "type": "string"
                    },
                    "u": {
                      "description": "Edge blinding nonce",
                      "type": "string"
                    },
                    "n": {
                      "description": "SAID of the far node (credential)",
                      "type": "string"
                    },
                    "s": {
                      "description": "SAID of the far node's schema",
                      "type": "string"
                    },
                    "o": {
                      "description": "Edge operator",
                      "enum": [
                        "I2I",
                        "NI2I"
                      ]
                    }
                  },
                  "additionalProperties": false
                }
              ]
            }
          },
          "additionalProperties": false
        }
      ]
    },
    "r": {
      "description": "SAID of the governing SEDI guardianship governance framework (sedi-guardian/rules.json)",
      "type": "string"
    }
  },
  "additionalProperties": false
}
