{
  "v": "ACDCCAACAAJSONAAXb.",
  "t": "acm",
  "d": "EMSMfOalKt9kR5aX85QAtQg8-6z6Zsh1v3kZvATBxumP",
  "u": "0ABkZXNpZ250c2FsdHBhZDAw",
  "i": "EDB8gKNwzurf33pV2hsyGR9XFOmitDhc0LUzDamcU2JR",
  "rd": "EC-DlJTW3_34SsV5PSG0-U7hxR3uVj8JfCoC5e-8pCBB",
  "s": "EGpQePxZPKq9nPF99rI9IawvJgMukfPxjI6WKN8GFVfV",
  "a": {
    "ward": {
      "d": "EFAMpHMLlUWnM8ElFLfpi_Z2s9674PG-l1HpdFfkoAn2",
      "u": "0ABzZWRpd2FyZG5vbmNlMDAw",
      "i": "EDB8gKNwzurf33pV2hsyGR9XFOmitDhc0LUzDamcU2JR"
    },
    "d": "EGnMEHj3M0pEvFSCcwnUGbluflbuOmsCr4AV7bYsGM_Q",
    "u": "0ABkZXNpZ25hc2FsdHBhZDAw",
    "i": "EDB8gKNwzurf33pV2hsyGR9XFOmitDhc0LUzDamcU2JR",
    "basis": "designatedRepresentative",
    "subtype": "healthCareAgent",
    "fiduciary": "substitutedJudgment",
    "capacityConditioned": true,
    "recognition": {
      "authorityType": "selfExecuted",
      "instrumentReference": "Utah Advance Health Care Directive 2026-01-15",
      "appointingState": "US-UT",
      "registrationStatus": "native"
    },
    "effectiveDate": "2026-01-15",
    "scope": [
      "healthCare"
    ],
    "powers": [
      "read",
      "message",
      "profile"
    ]
  },
  "e": {
    "citizen": {
      "d": "EIpTvLvNGF4FABNzs9g-B-yRFEBMBESr4ybEgsZ8eyw-",
      "u": "0ABnNHNzYWx0cGFkMDAwMDAw",
      "n": "ENOVdsuMryEUCyZ1qQ26VSqtIMEzgOdyqZ2WCx2S11Nf",
      "s": "EAyyREL1r5OL8Z9HGl47df26rn_JRLsC7PVDBH5RtwLs",
      "o": "E1E"
    },
    "d": "EAJ8I6skyaGpQB9Ba2KE_zjX3b42f8VDl02VgarT2Sq5",
    "u": "0ABkZXNpZ25lc2FsdHBhZDAw",
    "authorization": {
      "d": "EIXyneEobquN0pLOo5f7F2SQRB21hTAxz6yEYBdu92iw",
      "u": "0ABnNGFzYWx0cGFkMDAwMDAw",
      "n": "EK3wMuDAlB1UrG_j6vZlDClD_hp71nYyedWxcVwcMBZ1",
      "s": "EJvd1ns0KVsbB4Ji1MEv4cdq8WOSQezILlluN63K_JOH",
      "o": "NI2I"
    }
  },
  "r": "EKLBoGWUawixiHtnA5LZ23cPfWjG1niiLlRIhDUGmHRz"
}
