{
  "v": "ACDCCAACAAJSONAAYc.",
  "t": "acm",
  "d": "ENTnvjMDJ3slLpYefpVT2SLXwSG7MZNj0Dj7IgBjJfTT",
  "u": "0ABtaW5vcnRzYWx0cGFkMDAw",
  "i": "EGA-48IbFJLG0nG0nv2eJoevtvNpElOqnSM_HBDZNNgc",
  "rd": "EC-DlJTW3_34SsV5PSG0-U7hxR3uVj8JfCoC5e-8pCBB",
  "s": "EGpQePxZPKq9nPF99rI9IawvJgMukfPxjI6WKN8GFVfV",
  "a": {
    "ward": {
      "d": "EFAMpHMLlUWnM8ElFLfpi_Z2s9674PG-l1HpdFfkoAn2",
      "u": "0ABzZWRpd2FyZG5vbmNlMDAw",
      "i": "EDB8gKNwzurf33pV2hsyGR9XFOmitDhc0LUzDamcU2JR"
    },
    "d": "EF3ODwWgvcW6l0sPLscQK2Y6lE0mPdGfTSKB2psRhPei",
    "u": "0ABtaW5vcmFzYWx0cGFkMDAw",
    "i": "EDB8gKNwzurf33pV2hsyGR9XFOmitDhc0LUzDamcU2JR",
    "basis": "courtGuardianMinor",
    "fiduciary": "bestInterest",
    "residualParentalRights": true,
    "recognition": {
      "authorityType": "court",
      "court": "Third District Court, Salt Lake County",
      "caseNumber": "234500456",
      "orderDate": "2026-01-05",
      "lettersReference": "Letters of Guardianship 234500456-LG",
      "appointingState": "US-UT",
      "registrationStatus": "native"
    },
    "effectiveDate": "2026-01-05",
    "expiryDate": "2035-06-15",
    "scope": [
      "plenary"
    ],
    "powers": [
      "read",
      "message",
      "profile"
    ]
  },
  "e": {
    "citizen": {
      "d": "EC9UySmC7s_HVrNp7l-bsSQeJr_pYUA83FYESO08L-u-",
      "u": "0ABnMnNzYWx0cGFkMDAwMDAw",
      "n": "ENOVdsuMryEUCyZ1qQ26VSqtIMEzgOdyqZ2WCx2S11Nf",
      "s": "EAyyREL1r5OL8Z9HGl47df26rn_JRLsC7PVDBH5RtwLs",
      "o": "E1E"
    },
    "d": "EF10-_d5R3M3F56GXNjhLyf0owuGkUQbAZiULTR3nPwv",
    "u": "0ABtaW5vcmVzYWx0cGFkMDAw",
    "authorization": {
      "d": "ELesXEHTeyJ2ewVbIZATHXSxh4jmiWEj5-qFwEFIO3e_",
      "u": "0ABnMmFzYWx0cGFkMDAwMDAw",
      "n": "EEqsoVIuqvwjP0wkD-flWrZDHhbjn2tM0FeXt0XeXNQv",
      "s": "EJvd1ns0KVsbB4Ji1MEv4cdq8WOSQezILlluN63K_JOH",
      "o": "NI2I"
    }
  },
  "r": "EKLBoGWUawixiHtnA5LZ23cPfWjG1niiLlRIhDUGmHRz"
}
